{
  "schema_version": 1,
  "checked_at": "2026-10-27",
  "review_after_days": 45,
  "preferred_product": "bitbrowser",
  "affiliate_url": "https://www.bitbrowser.cn/?code=8467b4",
  "products": [
    {
      "id": "bitbrowser",
      "name": "比特浏览器 BitBrowser",
      "detail_path": "browsers/bitbrowser.md",
      "official_url": "https://www.bitbrowser.cn/?code=8467b4",
      "featured_plan": "cn-50",
      "summary": "免费 Local API、RPA 与同步器；支持代理配置和 MCP 接入",
      "sources": [
        {
          "id": "bit-free",
          "site": "international",
          "document": "国际站价格卡 /price：免费档",
          "official_url": "https://www.bitbrowser.cn/?code=8467b4",
          "checked_at": "2026-10-27",
          "note": "免费细项来自国际站；中国站 FAQ 同时列明永久免费 10 个环境"
        },
        {
          "id": "bit-cn",
          "site": "cn",
          "document": "中国站价格方案 /price：50 窗口档",
          "official_url": "https://www.bitbrowser.cn/?code=8467b4",
          "checked_at": "2026-10-27",
          "note": ""
        }
      ],
      "plans": [
        {
          "id": "free",
          "name": "免费版",
          "profiles": 10,
          "amount": 0,
          "currency": null,
          "billing_period": "free",
          "price_type": "free",
          "site": "international",
          "profile_scope": "browser",
          "users_count": 1,
          "users_label": "1 名成员",
          "create_limit": 20,
          "create_period": "day",
          "open_limit": 50,
          "recreation_limit": null,
          "monthly_additional_create": null,
          "monthly_additional_open": null,
          "intro_profiles": null,
          "intro_months": null,
          "trial_days": null,
          "api": true,
          "rpa": true,
          "sync": true,
          "source_ids": [
            "bit-free"
          ],
          "checked_at": "2026-10-27",
          "confidence": "verified",
          "conflict_note": "",
          "conditions": "",
          "proxy_mb_once": null,
          "mobile_minutes_once": null,
          "mobile_profiles_once": null
        },
        {
          "id": "cn-50",
          "name": "50 窗口套餐",
          "profiles": 50,
          "amount": 50,
          "currency": "CNY",
          "billing_period": "month",
          "price_type": "fixed",
          "site": "cn",
          "profile_scope": "browser",
          "users_count": 2,
          "users_label": "2 名员工",
          "create_limit": null,
          "create_period": null,
          "open_limit": null,
          "recreation_limit": null,
          "monthly_additional_create": null,
          "monthly_additional_open": null,
          "intro_profiles": null,
          "intro_months": null,
          "trial_days": null,
          "api": true,
          "rpa": true,
          "sync": true,
          "source_ids": [
            "bit-cn"
          ],
          "checked_at": "2026-10-27",
          "confidence": "verified",
          "conflict_note": "",
          "conditions": "中国站人民币月付；代理 IP 另行配置",
          "proxy_mb_once": null,
          "mobile_minutes_once": null,
          "mobile_profiles_once": null
        }
      ],
      "os_support": {
        "windows": "Windows 10+，64 位",
        "macos": "macOS 12+，Intel / Apple Silicon",
        "linux": null
      },
      "price_note": ""
    },
    {
      "id": "adspower",
      "name": "AdsPower",
      "detail_path": "browsers/adspower.md",
      "official_url": "https://www.adspower.com/pricing",
      "featured_plan": "professional",
      "summary": "RPA 流程编辑、模板分享与 API 成员授权",
      "sources": [
        {
          "id": "ads-price",
          "site": "international",
          "document": "官方 Pricing 页面",
          "official_url": "https://www.adspower.com/pricing",
          "checked_at": "2026-10-27",
          "note": ""
        }
      ],
      "plans": [
        {
          "id": "free",
          "name": "Free",
          "profiles": 2,
          "amount": 0,
          "currency": null,
          "billing_period": "free",
          "price_type": "free",
          "site": "international",
          "profile_scope": "browser",
          "users_count": 1,
          "users_label": "1 超级管理员，0 额外成员",
          "create_limit": null,
          "create_period": null,
          "open_limit": null,
          "recreation_limit": null,
          "monthly_additional_create": null,
          "monthly_additional_open": null,
          "intro_profiles": null,
          "intro_months": null,
          "trial_days": 7,
          "api": null,
          "rpa": null,
          "sync": null,
          "source_ids": [
            "ads-price"
          ],
          "checked_at": "2026-10-27",
          "confidence": "verified",
          "conflict_note": "",
          "conditions": "",
          "proxy_mb_once": null,
          "mobile_minutes_once": null,
          "mobile_profiles_once": null
        },
        {
          "id": "professional",
          "name": "Professional",
          "profiles": null,
          "amount": null,
          "currency": "USD",
          "billing_period": "month",
          "price_type": "dynamic",
          "site": "international",
          "profile_scope": "browser",
          "users_count": null,
          "users_label": "1 超级管理员，额外成员按配置",
          "create_limit": null,
          "create_period": null,
          "open_limit": null,
          "recreation_limit": null,
          "monthly_additional_create": null,
          "monthly_additional_open": null,
          "intro_profiles": null,
          "intro_months": null,
          "trial_days": 7,
          "api": true,
          "rpa": null,
          "sync": null,
          "source_ids": [
            "ads-price"
          ],
          "checked_at": "2026-10-27",
          "confidence": "verified",
          "conflict_note": "",
          "conditions": "按环境数量、额外成员和付款周期配置报价",
          "proxy_mb_once": null,
          "mobile_minutes_once": null,
          "mobile_profiles_once": null
        }
      ],
      "os_support": {
        "windows": null,
        "macos": null,
        "linux": null
      },
      "price_note": ""
    },
    {
      "id": "gologin",
      "name": "GoLogin",
      "detail_path": "browsers/gologin.md",
      "official_url": "https://gologin.com/pricing/",
      "featured_plan": "professional-10",
      "summary": "付费云端启动、API 与跨设备使用",
      "sources": [
        {
          "id": "go-help",
          "site": "international",
          "document": "套餐帮助 Pricing",
          "official_url": "https://support.gologin.com/en/articles/14617029-pricing",
          "checked_at": "2026-10-27",
          "note": ""
        }
      ],
      "plans": [
        {
          "id": "free",
          "name": "Forever Free",
          "profiles": 3,
          "amount": 0,
          "currency": null,
          "billing_period": "free",
          "price_type": "free",
          "site": "international",
          "profile_scope": "browser",
          "users_count": null,
          "users_label": "无额外团队成员",
          "create_limit": 25,
          "create_period": "calendar_month",
          "open_limit": null,
          "recreation_limit": null,
          "monthly_additional_create": null,
          "monthly_additional_open": null,
          "intro_profiles": null,
          "intro_months": null,
          "trial_days": 7,
          "api": false,
          "rpa": null,
          "sync": null,
          "source_ids": [
            "go-help"
          ],
          "checked_at": "2026-10-27",
          "confidence": "verified",
          "conflict_note": "",
          "conditions": "删除不返还创建次数；每月 1 日 00:00 UTC 重置；不含云端启动、Cookie 导出与分享",
          "proxy_mb_once": null,
          "mobile_minutes_once": null,
          "mobile_profiles_once": null
        },
        {
          "id": "professional-10",
          "name": "Professional 10",
          "profiles": 10,
          "amount": 9,
          "currency": "USD",
          "billing_period": "month",
          "price_type": "fixed",
          "site": "international",
          "profile_scope": "browser",
          "users_count": null,
          "users_label": "额外成员另购",
          "create_limit": null,
          "create_period": null,
          "open_limit": null,
          "recreation_limit": null,
          "monthly_additional_create": null,
          "monthly_additional_open": null,
          "intro_profiles": null,
          "intro_months": null,
          "trial_days": null,
          "api": true,
          "rpa": null,
          "sync": null,
          "source_ids": [
            "go-help"
          ],
          "checked_at": "2026-10-27",
          "confidence": "verified",
          "conflict_note": "",
          "conditions": "新价格适用于 2026 年 1 月起注册账号；API 300 RPM，1 个并发云端会话、100 小时总使用量",
          "proxy_mb_once": null,
          "mobile_minutes_once": null,
          "mobile_profiles_once": null
        }
      ],
      "os_support": {
        "windows": null,
        "macos": null,
        "linux": null
      },
      "price_note": "新定价账号"
    },
    {
      "id": "morelogin",
      "name": "MoreLogin",
      "detail_path": "browsers/morelogin.md",
      "official_url": "https://www.morelogin.com/pricing",
      "featured_plan": "pro-10",
      "summary": "免费 2 用户；同步器、Local API 与独立云手机产品",
      "sources": [
        {
          "id": "more-price",
          "site": "international",
          "document": "官方 Pricing 与功能表",
          "official_url": "https://www.morelogin.com/pricing",
          "checked_at": "2026-10-27",
          "note": ""
        }
      ],
      "plans": [
        {
          "id": "free",
          "name": "Free",
          "profiles": 2,
          "amount": 0,
          "currency": null,
          "billing_period": "free",
          "price_type": "free",
          "site": "international",
          "profile_scope": "browser",
          "users_count": 2,
          "users_label": "2 个用户（总数）",
          "create_limit": null,
          "create_period": null,